{
  "graft": "0.2.0",
  "concept": "6f8c2e14-9a71-4d3b-b0e6-1c4d8a7f92ab",
  "clock": {
    "rate": { "num": 30, "den": 1 },
    "duration_frames": 690
  },
  "slots": [
    {
      "id": "hook",
      "role": "hook",
      "range": { "start": 0, "duration": 90 },
      "window": {
        "kind": "hook_rate",
        "range": { "start": 0, "duration": 90 }
      }
    },
    {
      "id": "body",
      "role": "body",
      "range": { "start": 90, "duration": 510 }
    },
    {
      "id": "cta",
      "role": "cta",
      "range": { "start": 600, "duration": 90 },
      "optional": true
    }
  ],
  "layers": ["base", "copy", "grade", "legal"],
  "dest_default": "9x16",
  "spill_threshold_frames": 11
}
